{
  "version": 1,
  "generatedFrom": "lesson-specs/intro-001.yaml",
  "id": "intro-001",
  "title": {
    "zh": "自我介紹",
    "en": "Introduce yourself"
  },
  "level": "A1",
  "scenario": {
    "zh": "第一次見面時，用簡短句子介紹自己。",
    "en": "Introduce yourself with short sentences when meeting someone."
  },
  "goal": {
    "zh": "能用自己的名字說「我是……」，完成一個簡短自我介紹。",
    "en": "Say “I am …” with your name and complete a short self-introduction."
  },
  "targetPhrases": [
    {
      "id": "intro-i",
      "hanji": "我",
      "tailo": "Guá",
      "poj": "Goá",
      "meaning": {
        "zh": "我",
        "en": "I; me"
      },
      "cultureNote": {
        "zh": "「我」是自我介紹最基本的開頭，先熟悉這個代詞再接名字。",
        "en": "“I” is the simplest start to an introduction before adding your name."
      },
      "sources": [
        "https://sutian.moe.edu.tw/zh-hant/su/3139/"
      ],
      "contentStatus": "provisional",
      "source": {
        "title": {
          "zh": "教育部《臺灣台語常用詞辭典》",
          "en": "MOE Dictionary of Frequently-Used Taiwan Taigi"
        },
        "canonicalUrl": "https://sutian.moe.edu.tw/zh-hant/su/3139/",
        "license": "CC BY-ND 3.0 TW",
        "licenseUrl": "https://creativecommons.org/licenses/by-nd/3.0/tw/",
        "speaker": null
      },
      "audio": {
        "audioUrl": "/audio/generated/intro-001-i.mp3",
        "originalUrl": "https://sutian.moe.edu.tw/media/senn/mp3/imtong/subak/3/3139.mp3",
        "sourceUrl": "https://sutian.moe.edu.tw/zh-hant/su/3139/",
        "license": "CC BY-ND 3.0 TW",
        "licenseUrl": "https://creativecommons.org/licenses/by-nd/3.0/tw/",
        "speaker": null,
        "isUnmodifiedOriginal": true
      }
    },
    {
      "id": "intro-called",
      "hanji": "叫",
      "tailo": "Kiò",
      "poj": "Kiò",
      "meaning": {
        "zh": "叫做、名叫",
        "en": "to be called; to be named"
      },
      "cultureNote": {
        "zh": "說名字時，「我叫……」是簡短又容易開始的句型。",
        "en": "“I am called …” is a short, beginner-friendly way to say your name."
      },
      "sources": [
        "https://sutian.moe.edu.tw/zh-hant/su/1402/"
      ],
      "contentStatus": "provisional",
      "source": {
        "title": {
          "zh": "教育部《臺灣台語常用詞辭典》",
          "en": "MOE Dictionary of Frequently-Used Taiwan Taigi"
        },
        "canonicalUrl": "https://sutian.moe.edu.tw/zh-hant/su/1402/",
        "license": "CC BY-ND 3.0 TW",
        "licenseUrl": "https://creativecommons.org/licenses/by-nd/3.0/tw/",
        "speaker": null
      },
      "audio": {
        "audioUrl": "/audio/generated/intro-001-name.mp3",
        "originalUrl": "https://sutian.moe.edu.tw/media/senn/mp3/imtong/subak/1/1402.mp3",
        "sourceUrl": "https://sutian.moe.edu.tw/zh-hant/su/1402/",
        "license": "CC BY-ND 3.0 TW",
        "licenseUrl": "https://creativecommons.org/licenses/by-nd/3.0/tw/",
        "speaker": null,
        "isUnmodifiedOriginal": true
      }
    },
    {
      "id": "intro-be",
      "hanji": "是",
      "tailo": "Sī",
      "poj": "Sī",
      "meaning": {
        "zh": "是",
        "en": "to be"
      },
      "cultureNote": {
        "zh": "「我是學生」這類句子，可以把身分或角色接在「是」後面。",
        "en": "In “I am a student,” a role or identity follows “to be.”"
      },
      "sources": [
        "https://sutian.moe.edu.tw/zh-hant/su/4997/"
      ],
      "contentStatus": "provisional",
      "source": {
        "title": {
          "zh": "教育部《臺灣台語常用詞辭典》",
          "en": "MOE Dictionary of Frequently-Used Taiwan Taigi"
        },
        "canonicalUrl": "https://sutian.moe.edu.tw/zh-hant/su/4997/",
        "license": "CC BY-ND 3.0 TW",
        "licenseUrl": "https://creativecommons.org/licenses/by-nd/3.0/tw/",
        "speaker": null
      },
      "audio": {
        "audioUrl": "/audio/generated/intro-001-be.mp3",
        "originalUrl": "https://sutian.moe.edu.tw/media/senn/mp3/imtong/subak/4/4997.mp3",
        "sourceUrl": "https://sutian.moe.edu.tw/zh-hant/su/4997/",
        "license": "CC BY-ND 3.0 TW",
        "licenseUrl": "https://creativecommons.org/licenses/by-nd/3.0/tw/",
        "speaker": null,
        "isUnmodifiedOriginal": true
      }
    }
  ],
  "vocabulary": [
    {
      "id": "intro-i",
      "hanji": "我",
      "tailo": "Guá",
      "poj": "Goá",
      "meaning": {
        "zh": "我",
        "en": "I; me"
      },
      "sources": [
        "https://sutian.moe.edu.tw/zh-hant/su/3139/"
      ],
      "contentStatus": "provisional"
    },
    {
      "id": "intro-called",
      "hanji": "叫",
      "tailo": "Kiò",
      "poj": "Kiò",
      "meaning": {
        "zh": "叫做、名叫",
        "en": "to be called; to be named"
      },
      "sources": [
        "https://sutian.moe.edu.tw/zh-hant/su/1402/"
      ],
      "contentStatus": "provisional"
    },
    {
      "id": "intro-be",
      "hanji": "是",
      "tailo": "Sī",
      "poj": "Sī",
      "meaning": {
        "zh": "是",
        "en": "to be"
      },
      "sources": [
        "https://sutian.moe.edu.tw/zh-hant/su/4997/"
      ],
      "contentStatus": "provisional"
    }
  ],
  "steps": [
    {
      "type": "context",
      "title": {
        "zh": "進入情境",
        "en": "Set the context"
      },
      "prompt": {
        "zh": "第一次見面時，用簡短句子介紹自己。",
        "en": "Introduce yourself with short sentences when meeting someone."
      }
    },
    {
      "type": "input",
      "title": {
        "zh": "先看目標句",
        "en": "See the target"
      },
      "prompt": {
        "zh": "能用自己的名字說「我是……」，完成一個簡短自我介紹。",
        "en": "Say “I am …” with your name and complete a short self-introduction."
      }
    },
    {
      "type": "listen",
      "title": {
        "zh": "聽原音",
        "en": "Listen to the source audio"
      },
      "prompt": {
        "zh": "先聽，再看羅馬字。",
        "en": "Listen before looking at romanization."
      }
    },
    {
      "type": "repeat",
      "title": {
        "zh": "跟著說",
        "en": "Repeat"
      },
      "prompt": {
        "zh": "跟著原音慢慢說。",
        "en": "Repeat the phrase at a comfortable pace."
      }
    },
    {
      "type": "constrained-dialogue",
      "title": {
        "zh": "受限對話",
        "en": "Constrained dialogue"
      },
      "prompt": {
        "zh": "能用自己的名字說「我是……」，完成一個簡短自我介紹。",
        "en": "Say “I am …” with your name and complete a short self-introduction."
      }
    },
    {
      "type": "feedback",
      "title": {
        "zh": "確認意思",
        "en": "Check meaning"
      },
      "prompt": {
        "zh": "確認你說的是目標意思。",
        "en": "Check that your phrase matches the intended meaning."
      }
    },
    {
      "type": "review",
      "title": {
        "zh": "回想",
        "en": "Review"
      },
      "prompt": {
        "zh": "遮住答案，試著自己說。",
        "en": "Hide the answer and try to say it from memory."
      }
    },
    {
      "type": "completion",
      "title": {
        "zh": "完成口說任務",
        "en": "Complete the speaking task"
      },
      "prompt": {
        "zh": "能用自己的名字說「我是……」，完成一個簡短自我介紹。",
        "en": "Say “I am …” with your name and complete a short self-introduction."
      }
    }
  ],
  "reviewItems": [
    {
      "id": "intro-001-review-intro-i",
      "targetPhraseId": "intro-i",
      "prompt": {
        "zh": "看到意思時，試著說出「我」。",
        "en": "When you see the meaning, try to say “我.”"
      }
    },
    {
      "id": "intro-001-review-intro-called",
      "targetPhraseId": "intro-called",
      "prompt": {
        "zh": "看到意思時，試著說出「叫」。",
        "en": "When you see the meaning, try to say “叫.”"
      }
    },
    {
      "id": "intro-001-review-intro-be",
      "targetPhraseId": "intro-be",
      "prompt": {
        "zh": "看到意思時，試著說出「是」。",
        "en": "When you see the meaning, try to say “是.”"
      }
    }
  ],
  "sources": [
    "https://sutian.moe.edu.tw/zh-hant/su/3139/",
    "https://sutian.moe.edu.tw/zh-hant/su/1402/",
    "https://sutian.moe.edu.tw/zh-hant/su/4997/"
  ],
  "contentStatus": "provisional"
}
